{
  "$schema": "https://json-schema.org/draft/2020-12/schema",
  "$id": "https://saitenka.dev/contracts/schema/journey-v0.json",
  "title": "Saitenka composed watch-hover-mine journey v0",
  "type": "object",
  "additionalProperties": false,
  "required": ["scenario_id","given","when","expect"],
  "properties": {"scenario_id":{"type":"string","pattern":"^[a-z0-9]+(?:-[a-z0-9]+)*$"},"given":{"type":"object","additionalProperties":false,"required":["viewport","cue","mpv_properties","word_state","dictionary","mining"],"properties":{"viewport":{"type":"array","prefixItems":[{"type":"integer"},{"type":"integer"}],"items":false},"cue":{"type":"string"},"mpv_properties":{"type":"object","additionalProperties":false,"required":["path","time-pos","sub-text","sid","sub-start","sub-end"],"properties":{"path":{"type":"string"},"time-pos":{"type":"number"},"sub-text":{"type":"string"},"sid":{"type":"integer"},"sub-start":{"type":"number"},"sub-end":{"type":"number"}}},"word_state":{"type":"object","additionalProperties":false,"required":["known","fsrs"],"properties":{"known":{"type":"array","items":{"type":"string"},"uniqueItems":true},"fsrs":{"type":"object","additionalProperties":{"enum":["new","learning","young","known","forgotten"]}}}},"dictionary":{"type":"object","additionalProperties":false,"required":["expression","reading","headword","definitions","visible_marker","glossary_html","glosses","pitch_html","pitch_positions"],"properties":{"expression":{"type":"string"},"reading":{"type":"string"},"headword":{"type":"array","minItems":1},"definitions":{"type":"array","minItems":1,"items":{"type":"object","additionalProperties":false,"required":["source","content"],"properties":{"source":{"type":"string"},"content":{"type":"array"}}}},"visible_marker":{"type":"string"},"glossary_html":{"type":"string"},"glosses":{"type":"array","items":{"type":"string"}},"pitch_html":{"type":"string"},"pitch_positions":{"type":"string"}}},"mining":{"type":"object","additionalProperties":false,"required":["config","media"],"properties":{"config":{"type":"object","additionalProperties":false,"required":["card_format"],"properties":{"card_format":{"type":"object","additionalProperties":{"type":"string"},"minProperties":1}}},"media":{"type":"object","additionalProperties":false,"required":["screenshot","sentence_audio"],"properties":{"screenshot":{"type":"string"},"sentence_audio":{"type":"string"}}}}}}},"when":{"type":"array","minItems":1,"items":{"oneOf":[{"type":"object","additionalProperties":false,"required":["action"],"properties":{"action":{"const":"present-cue"}}},{"type":"object","additionalProperties":false,"required":["action","index"],"properties":{"action":{"const":"hover-token"},"index":{"type":"integer"}}},{"type":"object","additionalProperties":false,"required":["action"],"properties":{"action":{"const":"mine-hovered"}}},{"type":"object","additionalProperties":false,"required":["action","max_steps"],"properties":{"action":{"const":"await-note"},"max_steps":{"type":"integer","minimum":1}}}]}},"expect":{"type":"array","minItems":1}}
}
