[
  {
    "scenario_id": "watch-hover-mine-rich-card",
    "given": {
      "viewport": [
        1920,
        1080
      ],
      "cue": "本を読む",
      "mpv_properties": {
        "path": "/video/[Grp] Show - 03 [1080p].mkv",
        "time-pos": 63,
        "sub-text": "本を読む",
        "sid": 1,
        "sub-start": 60.0,
        "sub-end": 64.0
      },
      "word_state": {
        "known": [],
        "fsrs": {
          "本": "learning",
          "読む": "young"
        }
      },
      "dictionary": {
        "expression": "読む",
        "reading": "よむ",
        "headword": [
          "読む",
          {
            "tag": "rt",
            "content": "よむ"
          }
        ],
        "definitions": [
          {
            "source": "PortableDict",
            "content": [
              "契約辞書定義。関連語は",
              {
                "tag": "a",
                "href": "?query=見る",
                "content": "見る"
              },
              "。"
            ]
          }
        ],
        "visible_marker": "契約辞書定義",
        "glossary_html": "<ol><li>contract dictionary definition</li></ol>",
        "glosses": [
          "contract dictionary definition"
        ],
        "pitch_html": "<span>よむ [1]</span>",
        "pitch_positions": "1"
      },
      "mining": {
        "config": {
          "card_format": {
            "Word": "{expression}",
            "Reading": "{reading}",
            "Glossary": "{glossary}",
            "Pitch": "{pitch-accents}",
            "Sentence": "{cloze-prefix}<b>{cloze-body}</b>{cloze-suffix}",
            "Picture": "{screenshot}",
            "Audio": "{sentence-audio}"
          }
        },
        "media": {
          "screenshot": "scene.webp",
          "sentence_audio": "sentence.mp3"
        }
      }
    },
    "when": [
      {
        "action": "present-cue"
      },
      {
        "action": "hover-token",
        "index": 2
      },
      {
        "action": "mine-hovered"
      },
      {
        "action": "await-note",
        "max_steps": 200
      }
    ],
    "expect": [
      {
        "surface": "subtitle",
        "tokens": [
          {
            "text": "本",
            "role": "learning",
            "color": [
              238,
              212,
              159,
              255
            ]
          },
          {
            "text": "を",
            "role": "base",
            "color": [
              202,
              211,
              245,
              255
            ]
          },
          {
            "text": "読む",
            "role": "young",
            "color": [
              139,
              213,
              202,
              255
            ]
          }
        ]
      },
      {
        "surface": "tooltip",
        "selected": 2,
        "reading": "よむ",
        "link_targets": [
          "kanji:読",
          "見る"
        ],
        "definition_visible": true
      },
      {
        "boundary": "media",
        "captures": [
          {
            "video": "/video/[Grp] Show - 03 [1080p].mkv",
            "screenshot": "scene.webp",
            "sentence_audio": "sentence.mp3"
          }
        ]
      },
      {
        "boundary": "anki",
        "note": {
          "deckName": "Saitenka::Mining",
          "modelName": "Lapis",
          "fields": {
            "Word": "読む",
            "Reading": "よむ",
            "Glossary": "<ol><li>contract dictionary definition</li></ol>",
            "Pitch": "<span>よむ [1]</span>",
            "Sentence": "本を<b>読む</b>",
            "Picture": "<img src=\"scene.webp\">",
            "Audio": "[sound:sentence.mp3]",
            "IsWordAndSentenceCard": "1"
          },
          "tags": [
            "saitenka",
            "saitenka::mined",
            "saitenka::source::Show",
            "saitenka::ep::03"
          ],
          "options": {
            "allowDuplicate": false
          }
        }
      }
    ]
  }
]
